{
  "$schema": "http://json-schema.org/draft-07/schema#",
  "$id": "vault/shared/schemas/quote.json",
  "title": "Quote",
  "description": "Structured data extracted from a materials receipt or supplier invoice",
  "type": "object",
  "required": ["id", "tenant_id", "created_at", "status", "source_file", "line_items", "subtotal", "tax", "total"],
  "additionalProperties": false,
  "properties": {
    "id":          { "type": "string", "format": "uuid" },
    "tenant_id":   { "type": "string", "format": "uuid" },
    "created_at":  { "type": "string", "format": "date-time" },
    "status": {
      "type": "string",
      "enum": ["draft", "priced", "sent", "accepted", "rejected", "expired"]
    },
    "source_file": { "type": "string", "description": "Vault-relative path to the source PDF" },
    "supplier":    { "type": "string" },
    "line_items": {
      "type": "array",
      "items": {
        "type": "object",
        "required": ["description", "quantity", "unit", "unit_cost", "total_cost", "category"],
        "additionalProperties": false,
        "properties": {
          "description": { "type": "string" },
          "quantity":    { "type": "number", "minimum": 0 },
          "unit":        { "type": "string" },
          "unit_cost":   { "type": "number", "minimum": 0 },
          "total_cost":  { "type": "number", "minimum": 0 },
          "category": {
            "type": "string",
            "enum": ["lumber", "roofing", "electrical", "plumbing", "concrete", "paint", "hardware", "flooring", "other"]
          },
          "sku": { "type": "string" }
        }
      }
    },
    "subtotal": { "type": "number", "minimum": 0 },
    "tax":      { "type": "number", "minimum": 0 },
    "total":    { "type": "number", "minimum": 0 }
  }
}
