{
  "id":          "550e8400-e29b-41d4-a716-446655440000",
  "tenant_id":   "7c9e6679-7425-40de-944b-e07fc1f90ae7",
  "created_at":  "2024-03-01T09:00:00.000Z",
  "status":      "draft",
  "source_file": "vault/tenants/7c9e6679-7425-40de-944b-e07fc1f90ae7/inbox/pdf/home-depot-2024-03-01.pdf",
  "supplier":    "Home Depot",
  "line_items": [
    {
      "description": "2x4x8 Stud",
      "quantity":    50,
      "unit":        "each",
      "unit_cost":   4.87,
      "total_cost":  243.50,
      "category":    "lumber",
      "sku":         "100038946"
    },
    {
      "description": "1/2in OSB Sheathing 4x8",
      "quantity":    20,
      "unit":        "sheet",
      "unit_cost":   22.48,
      "total_cost":  449.60,
      "category":    "lumber"
    },
    {
      "description": "30-Year Architectural Shingles",
      "quantity":    15,
      "unit":        "square",
      "unit_cost":   98.75,
      "total_cost":  1481.25,
      "category":    "roofing",
      "sku":         "202847163"
    },
    {
      "description": "Roofing Felt 15lb",
      "quantity":    4,
      "unit":        "roll",
      "unit_cost":   31.20,
      "total_cost":  124.80,
      "category":    "roofing"
    },
    {
      "description": "12/2 NM-B Wire 250ft",
      "quantity":    3,
      "unit":        "roll",
      "unit_cost":   67.99,
      "total_cost":  203.97,
      "category":    "electrical",
      "sku":         "310058820"
    },
    {
      "description": "15A Single-Pole Breaker",
      "quantity":    6,
      "unit":        "each",
      "unit_cost":   8.45,
      "total_cost":  50.70,
      "category":    "electrical"
    },
    {
      "description": "1/2in PEX-A Tubing 100ft",
      "quantity":    2,
      "unit":        "coil",
      "unit_cost":   54.30,
      "total_cost":  108.60,
      "category":    "plumbing"
    },
    {
      "description": "Exterior Latex Paint 5gal",
      "quantity":    4,
      "unit":        "bucket",
      "unit_cost":   42.97,
      "total_cost":  171.88,
      "category":    "paint"
    },
    {
      "description": "3in Framing Nails 5lb",
      "quantity":    3,
      "unit":        "box",
      "unit_cost":   18.64,
      "total_cost":  55.92,
      "category":    "hardware"
    },
    {
      "description": "Hardwood Flooring 20sqft",
      "quantity":    10,
      "unit":        "box",
      "unit_cost":   89.00,
      "total_cost":  890.00,
      "category":    "flooring"
    }
  ],
  "subtotal": 3780.22,
  "tax":       302.42,
  "total":    4082.64
}
